CASIO,MQ24MG1EDF,VNPAYTGDD4,50000,100000,VNPAY-QR,1490000,1996000,36.0,Nam,34.7,8.0,Pin,3.0,Nhựa Resin,Nhật Bản,Tốt ko bị phai màu khi dùng lâu.
ORIENT Bambino,RAAG0029N10B,VNPAYTGDD4,50000,100000,VNPAY-QR,5990000,10310000,N/A,Nam,40.5,N/A,Cơ tự động,3.0,Kính khoáng Mineral,Nhật Bản,Cót lưu không được lâu nếu k đeo.
CITIZEN,EM040159E,VNPAYTGDD4,50000,100000,VNPAY-QR,5070000,7800000,0.0,Nữ,27.7,8.0,Ánh sáng,5.0,Kính Sapphire,Nhật Bản,N/A
CITIZEN,EZ636483A,VNPAYTGDD4,50000,100000,VNPAY-QR,3055000,4700000,24.0,Nữ,14.0,6.0,Pin,3.0,Kính khoáng Mineral,Nhật Bản,Good
Citizen FE610059AEcoDrive,Unknown,VNPAYTGDD4,50000,100000,VNPAY-QR,4745000,7300000,0.0,Nữ,37.0,9.0,Ánh sáng,5.0,Kính khoáng Mineral,Nhật Bản,N/A
FESTINA,F20382/3,VNPAYTGDD4,50000,100000,VNPAY-QR,3043000,3580000,36.0,Nữ,30.5,N/A,Pin,5.0,Kính khoáng Mineral,Thuỵ Sĩ,N/A
TITAN,2480SM02,VNPAYTGDD4,50000,100000,VNPAY-QR,900000,1800000,18.0,Nữ,35.0,7.8,Pin,5.0,Kính khoáng Mineral,Ấn Độ,Mẫu  mã đẹp. Cửa hàng phục vụ  rất  chứ đáo
TITAN,2554SL01,VNPAYTGDD4,50000,100000,VNPAY-QR,645000,1290000,18.0,Nữ,33.0,9.0,Pin,5.0,Kính khoáng Mineral,Ấn Độ,Sản phẩm tốt mọi người nên mua nha. Rẻ.
CITIZEN Mechanical,NH835008B,VNPAYTGDD4,50000,100000,VNPAY-QR,4563000,6085000,N/A,Nam,40.0,11.1,Cơ tự động,5.0,Kính khoáng Mineral,Nhật Bản,Máy chạy tốt. Khoảng 1 ngày rưỡi hết cót
TITAN,1730SL03,VNPAYTGDD4,50000,100000,VNPAY-QR,1100000,2200000,18.0,Nam,42.0,9.6,Pin,5.0,Kính khoáng Mineral,Ấn Độ,"Đồng hồ đẹp, mang vào rất sáng trọng , có kim dạ quang,rất hài long"
CITIZEN,BE917455A,VNPAYTGDD4,50000,100000,VNPAY-QR,3588000,4785000,24.0,Nam,39.0,9.7,Pin,5.0,Kính khoáng Mineral,Nhật Bản,Dù mình đến hơi muộn nhưng các bạn vẫn tư vấn rất nhiệt tình nha.
CITIZEN,EQ906550E,VNPAYTGDD4,50000,100000,VNPAY-QR,3110000,4785000,24.0,Nữ,34.0,7.4,Pin,5.0,Kính khoáng Mineral,Nhật Bản,"Đẹp, sang, hơi to so với tay nữ nhưng mà với ai cá tính thì hợp nha"
ORIENT Bambino,FAG00003W0,VNPAYTGDD4,50000,100000,VNPAY-QR,6375000,8500000,N/A,Nam,42.5,11.6,Cơ tự động,5.0,Kính khoáng Mineral,Nhật Bản,Có tiếng kêu bánh đà bên trong. Đã đến cửa hàng để thử các mẫu khác. Vẫn bị tiếng kêu như vậy. Trước đây đã dùng 1 cái đồng hồ cơ với mức giá tương tụ. Không nghe được tiếng kêu đó.
CASIO,AE3000WD1AVDF,VNPAYTGDD4,50000,100000,VNPAY-QR,1490000,1980000,120.0,Nam,55.5,15.8,Pin,10.0,Nhựa,Nhật Bản,Đồng hồ rất tốt
ORIENT Bambino,FAC00005W0,VNPAYTGDD4,50000,100000,VNPAY-QR,4990000,7920000,N/A,Nam,40.8,11.7,Cơ tự động,3.0,Kính khoáng Mineral,Nhật Bản,Tốt trong tầm giá
ORIENT Bambino,FAC0000BW0,VNPAYTGDD4,50000,100000,VNPAY-QR,4990000,7920000,N/A,Nam,40.6,11.6,Cơ tự động,3.0,Kính khoáng Mineral,Nhật Bản,Sản phẩm tốt
ORIENT Bambino,FAC00003W0,VNPAYTGDD4,50000,100000,VNPAY-QR,6375000,8500000,N/A,Nam,40.8,11.7,Cơ tự động,3.0,Kính khoáng Mineral,Nhật Bản,Muốn thay dây da chính hãng bên mình có thay không add
ORIENT,FUNG8002W0,VNPAYTGDD4,50000,100000,VNPAY-QR,4072000,5430000,36.0,Nam,39.8,7.4,Pin,5.0,Kính Sapphire,Nhật Bản,Rất đẹp và còn đẹp hơn trong ảnh nhé mn
ELIO,ES12301,VNPAYTGDD4,50000,100000,VNPAY-QR,690000,1290000,24.0,Nữ,35.5,9.0,Pin,3.0,Kính khoáng Mineral,Việt Nam,Đồng hồ rất đẹp và sang. Nhân viên giao hàng cực kỳ thân thiện
ELIO,ES12201,VNPAYTGDD4,50000,100000,VNPAY-QR,690000,1290000,24.0,Nữ,29.5,10.0,Pin,3.0,Kính khoáng Mineral,Việt Nam,"Đồng hồ đẹp, chất lượng phục vụ tốt"
ELIO,EL09702,VNPAYTGDD4,50000,100000,VNPAY-QR,690000,990000,24.0,Nữ,30.0,8.0,Pin,3.0,Kính khoáng Mineral,Việt Nam,"Dịch vụ TGDD rất tốt, sản phẩm đẹp và đúng với mô tả. Sẽ tiếp tục sử dụng dịch vụ của TGDD."
NAKZEN Hoa & Gió,SM4209L7NR,VNPAYTGDD4,50000,100000,VNPAY-QR,895000,1790000,24.0,Nữ,20.0,7.3,Pin,3.0,Kính khoáng Mineral,Nhật Bản,"Mặt đồng hồ màu xà cừ đẹp, nói chung là đeo lên xinh"
SMILE KID,SL08402,VNPAYTGDD4,50000,100000,VNPAY-QR,190000,290000,12.0,Trẻ em,37.0,9.0,Pin,3.0,Nhựa PMMA,Việt Nam,Đồng hồ đeo khá đẹp và tốt tôi rất thích
ELIO,EC00101,VNPAYTGDD4,50000,100000,VNPAY-QR,690000,1090000,24.0,Nam,42.0,9.2,Pin,3.0,Kính khoáng Mineral,Việt Nam,Tốt
SMILE KID,SL08802,VNPAYTGDD4,50000,100000,VNPAY-QR,290000,380000,12.0,Trẻ em,44.0,14.0,Pin,5.0,Nhựa PMMA,Việt Nam,Rat la ok
ELIO,EC01001,VNPAYTGDD4,50000,100000,VNPAY-QR,210000,890000,24.0,Nam,40.0,8.5,Pin,3.0,Kính khoáng Mineral,Việt Nam,Tuyệt vời
ELIO,EC00502,VNPAYTGDD4,50000,100000,VNPAY-QR,320000,1090000,24.0,Nữ,33.0,7.7,Pin,3.0,Kính khoáng Mineral,Việt Nam,Đồng hồ cực đẹp luôn nha đẹp hơn hình đáng đồng tiền bát gạo...tôi đã sở hữu thời gian còn bn thì sao
CASIO,MTPV300B1AUDF,VNPAYTGDD4,50000,100000,VNPAY-QR,1794000,2392000,24.0,Nam,41.5,8.6,Pin,3.0,Kính khoáng Mineral,Nhật Bản,Nhân viên tư vấn và chăm sóc khách hàng chu đáo nhiệt tình. Tuy nhiên trong hộp thì lại thiếu giấy bảo hành và sách hướng dẫn sử dụng.
CASIO,MTPVT01BL1BUDF,VNPAYTGDD4,50000,100000,VNPAY-QR,890000,1283000,24.0,Nam,40.0,8.2,Pin,5.0,Kính khoáng Mineral,Nhật Bản,"Đẹp lắm mà săn đúng hôm sale có 600 hơn, quá ưngggCổ tay 14cm nên phải ra TGDĐ nhờ nhân viên bấm thêm 1 lỗ đeo mới vừa"
FESTINA,F20512/2,VNPAYTGDD4,50000,100000,VNPAY-QR,2269000,2670000,24.0,Nam,39.3,9.0,Pin,5.0,Kính khoáng Mineral,Thuỵ Sĩ,Moi dung thay chưa có vấn đề ghi ca
ELIO Flower,ES10202,VNPAYTGDD4,50000,100000,VNPAY-QR,690000,1290000,24.0,Nữ,25.5,8.0,Pin,3.0,Kính khoáng Mineral,Việt Nam,Đẹp còn chạy bền thù phải chờ thời gian mới biết. Nhân viên nhiệt tình
ELIO Nàng Thơ,ES09601,VNPAYTGDD4,50000,100000,VNPAY-QR,690000,1190000,24.0,Nữ,20.0,7.7,Pin,3.0,Kính khoáng Mineral,Việt Nam,"Kiểu dáng trẻ trung, sang trọng và tiện lợi. Các bạn nam nên mua để làm quà tặng bạn gái minh ."
MVW,ML05301,VNPAYTGDD4,50000,100000,VNPAY-QR,890000,1690000,24.0,Nam,42.0,5.0,Pin,5.0,Kính Sapphire,Việt Nam,Giá rẻ nhưng nên quyết định kỷ khi mua. Phần vỏ màu vàng đã bị oxy hóa. Đã đổi lại nhưng dẫn ko khá hơn là mấy. Kim có dấu hiệu rỉ sét. Đúng tiền nào thì của đó
CANDINO,C4726/3,VNPAYTGDD4,50000,100000,VNPAY-QR,3930000,5240000,36.0,Nam,39.5,8.0,Pin,5.0,Kính Sapphire,Thuỵ Sĩ,N/A
GSHOCK,GA2000S1ADR,VNPAYTGDD4,50000,100000,VNPAY-QR,3363000,4484000,36.0,Nam,47.0,14.1,Pin,20.0,Kính khoáng Mineral,Nhật Bản,N/A
ELIO Xmas,ES08702,VNPAYTGDD4,50000,100000,VNPAY-QR,690000,1190000,24.0,Nữ,32.0,8.9,Pin,3.0,Kính khoáng Mineral,Việt Nam,Ở ngoài đẹp hơn trong hình
EDIFICE CASIO,EFRS108D2BVUDF,VNPAYTGDD4,50000,100000,VNPAY-QR,3502000,4670000,36.0,Nam,39.9,7.8,Pin,10.0,Kính Sapphire,Nhật Bản,N/A
ELIO,ES08101,VNPAYTGDD4,50000,100000,VNPAY-QR,690000,1190000,24.0,Nữ,32.0,9.1,Pin,3.0,Kính khoáng Mineral,Việt Nam,"Mới mua hôm qua ko để ý về tặng khui ra rớt 3 hột đá, viền xước mèo nhiều như đồ trưng bày"
Q&Q,S284J301Y,VNPAYTGDD4,50000,100000,VNPAY-QR,690000,990000,36.0,Nam,40.0,10.0,Pin,5.0,Kính khoáng Mineral,Nhật Bản,"Mới mua được một ngày nên chưa biết được là chất lượng như thế nào, nhưng với giá này thì ngon cho 1 chiếc đồng hồ đẹp, thiết kế đơn giản, sang trọng. Bộ máy Nhật thì chắc cũng ổn"
MVW Sport,ML04901,VNPAYTGDD4,50000,100000,VNPAY-QR,790000,1290000,24.0,Nam,46.0,11.0,Pin,5.0,Kính Sapphire,Việt Nam,"Sản phẩm sử dụng rất bền, đẹp"
Q&Q,S280J215Y,VNPAYTGDD4,50000,100000,VNPAY-QR,490000,990000,24.0,Nam,40.0,8.7,Pin,5.0,Kính Sapphire,Nhật Bản,"Cảm ơn hệ thống điện máy xanh, đã tư vấn nhiệt tình"
MVW Sport,ML08801,VNPAYTGDD4,50000,100000,VNPAY-QR,990000,1990000,24.0,Nam,44.0,12.6,Pin,5.0,Kính khoáng Mineral,Việt Nam,N/A
Q&Q,S280J322Y,VNPAYTGDD4,50000,100000,VNPAY-QR,690000,990000,24.0,Nam,40.0,8.7,Pin,5.0,Kính Sapphire,Nhật Bản,Mới vừa mua xong tgdd vòng xoay an phú thái độ nhân cảm thấy không tốt
ELIO Set quà,ES15602,VNPAYTGDD4,50000,100000,VNPAY-QR,890000,1390000,24.0,Nữ,22.5,8.0,Pin,3.0,Kính khoáng Mineral,Việt Nam,N/A
ELIO Set quà,ES15302,VNPAYTGDD4,50000,100000,VNPAY-QR,890000,1390000,24.0,Nữ,32.0,9.3,Pin,3.0,Kính khoáng Mineral,Việt Nam,N/A
ELIO Set quà,ES15401,VNPAYTGDD4,50000,100000,VNPAY-QR,890000,1390000,24.0,Nữ,32.0,7.9,Pin,3.0,Kính khoáng Mineral,Việt Nam,N/A
ELIO Set quà,ES16102,VNPAYTGDD4,50000,100000,VNPAY-QR,890000,1390000,24.0,Nữ,24.0,8.0,Pin,3.0,Kính khoáng Mineral,Việt Nam,Hàng đẹp chất lượng mà ko biết đeo như nào
ELIO Set quà,ES15501,VNPAYTGDD4,50000,100000,VNPAY-QR,890000,1390000,24.0,Nữ,24.0,8.9,Pin,3.0,Kính khoáng Mineral,Việt Nam,N/A
ELIO Set quà,ES15701,VNPAYTGDD4,50000,100000,VNPAY-QR,890000,1390000,24.0,Nữ,28.0,7.8,Pin,3.0,Kính khoáng Mineral,Việt Nam,"Mình đánh giá thay bạn gái Kiểu dáng sang xịn, tao nhã, thích nhất màu xanh ngọc bích của mặt đồng hồ. Bạn gái mình rất thích"
ELIO Set quà,ES15004,VNPAYTGDD4,50000,100000,VNPAY-QR,890000,1390000,24.0,Nữ,20.5,8.0,Pin,3.0,Kính khoáng Mineral,Việt Nam,N/A
CITIZEN,AN368157E,VNPAYTGDD4,50000,100000,VNPAY-QR,4788000,6385000,24.0,Nam,44.0,11.6,Pin,10.0,Kính khoáng Mineral,Nhật Bản,N/A
ORIENT Sun & Moon,RAAK0008S10B,VNPAYTGDD4,50000,100000,VNPAY-QR,9810000,13080000,N/A,Nam,42.5,14.0,Cơ tự động,5.0,Kính Sapphire,Nhật Bản,Ngon bổ rẻ tầm tiền đó thì e này nổi bật về thiết kế hay cấu hình cảm nhận riêng
CITIZEN Tsuyosa,NJ015889Y,VNPAYTGDD4,50000,100000,VNPAY-QR,9363000,12485000,N/A,Nam,40.0,11.7,Cơ tự động,5.0,Kính Sapphire,Nhật Bản,N/A
CASIO,MTPM100D7AVDF,VNPAYTGDD4,50000,100000,VNPAY-QR,2471000,3295000,36.0,Nam,42.5,9.6,Pin,5.0,Kính khoáng Mineral,Nhật Bản,N/A
CASIO,MTPM305D1AVDF,VNPAYTGDD4,50000,100000,VNPAY-QR,2825000,3767000,36.0,Nam,34.0,9.3,Pin,5.0,Kính khoáng Mineral,Nhật Bản,"Đồng hồ đẹp như hình, nhưng mặt to và dày nên đeo dễ bị thô, cạnh sắt của dây kim loại hơi sắc cà hơi đau , còn lại thì tạm thời ưng ạ"
Q&Q,C24A003VY,VNPAYTGDD4,50000,100000,VNPAY-QR,890000,1690000,24.0,Nam,42.5,10.9,Pin,5.0,Kính khoáng Mineral,Nhật Bản,"Đồng hồ đẹp, tốt trong tầm giá, chạy đúng giờ. Nhưng lúc mua mình không để ý thì mua về cầm chút cái thấy PHẦN DÂY nó xước nhỏ cũng nhiều, mà cái đó đánh lại đc nên bỏ qua. Phần dây đồng hồ này hơi lỏng lẻo mình sẽ nhiều bạn không thích nên nếu mua đồng hồ này mà bạn muốn đeo dây kim loại thì cố chút n mua casio nha, nó sẽ tốt hơn. Mặt đồng hồ đẹp k gì để chê."
ELIO Set quà,ES15002,VNPAYTGDD4,50000,100000,VNPAY-QR,890000,1390000,24.0,Nữ,20.5,8.0,Pin,3.0,Kính khoáng Mineral,Việt Nam,Ok ạ
MVW,ML08102,VNPAYTGDD4,50000,100000,VNPAY-QR,690000,1990000,36.0,Nam,40.0,7.8,Pin,5.0,Kính khoáng Mineral,Việt Nam,N/A
CITIZEN Mother Earth,EM091284Y,VNPAYTGDD4,50000,100000,VNPAY-QR,7790000,11985000,72.0,Nữ,30.0,8.4,Ánh sáng,5.0,Kính Sapphire,Nhật Bản,N/A
CITIZEN Sunshine and Luna,PR104088A,VNPAYTGDD4,50000,100000,VNPAY-QR,7725000,11885000,N/A,Nữ,28.5,9.9,Cơ tự động,5.0,Kính Sapphire,Nhật Bản,Ngoài đẹp hơn trong hình.
MVW,ML08101,VNPAYTGDD4,50000,100000,VNPAY-QR,690000,1990000,36.0,Nam,40.0,7.8,Pin,5.0,Kính khoáng Mineral,Việt Nam,Dây của đồng hồ này kích thước bao nhiêu vậy
ORIENT Mako,RAAA0818L19B,VNPAYTGDD4,50000,100000,VNPAY-QR,8775000,11700000,N/A,Nam,41.8,12.0,Cơ tự động,20.0,Kính Sapphire,Nhật Bản,"Sử dụng được 3 ngày, đồng hồ orient mako rất đẹp, mặt xanh hợp phong thủy với mệnh thủy. Chạy chính xác, độ trễ chấp nhận được, dòng diver này dễ phối đồ. Nhân viên tư vấn rất tốt, tư vấn để được giảm giá lên đến 40, giá tốt so với những cửa hàng khác. Mua ở tgdd để yên tâm hàng chính hãng. Ủng hộ chổ bán hàng uy tính và ủng hộ hàng chính hãng."
CASIO,MTPM305L7AVDF,VNPAYTGDD4,50000,100000,VNPAY-QR,2756000,3675000,36.0,Nam,34.0,9.3,Pin,5.0,Kính khoáng Mineral,Nhật Bản,Hàng đep thich hợp cho tay nhỏ như mình
CASIO,WS1600H1AVDF,VNPAYTGDD4,50000,100000,VNPAY-QR,790000,1251000,120.0,Nam,42.1,12.5,Pin,10.0,Nhựa,Nhật Bản,Tốt
MVW Sport,ML07503,VNPAYTGDD4,50000,100000,VNPAY-QR,990000,1990000,36.0,Nam,43.0,10.1,Pin,5.0,Kính khoáng Mineral,Việt Nam,Sản phẩm tốt trong tầm giá
EYKI,EYS00803,VNPAYTGDD4,50000,100000,VNPAY-QR,690000,1290000,24.0,Nữ,30.0,8.3,Pin,3.0,Kính khoáng Mineral,Trung Quốc,Sp rất tốt rẻ mà lại đẹp rất đáng để mua
EYKI,EYC02101,VNPAYTGDD4,50000,100000,VNPAY-QR,690000,1190000,24.0,Nam,40.0,8.7,Pin,3.0,Kính khoáng Mineral,Trung Quốc,N/A
EYKI,EYL00401,VNPAYTGDD4,50000,100000,VNPAY-QR,690000,1190000,24.0,Nam,43.0,10.4,Pin,3.0,Kính khoáng Mineral,Trung Quốc,N/A
EYKI,EYC00802,VNPAYTGDD4,50000,100000,VNPAY-QR,390000,990000,24.0,Nữ,29.0,7.6,Pin,3.0,Kính khoáng Mineral,Trung Quốc,N/A
EYKI,EYC02201,VNPAYTGDD4,50000,100000,VNPAY-QR,690000,1190000,24.0,Nam,40.0,8.7,Pin,3.0,Kính khoáng Mineral,Trung Quốc,N/A
CASIO,MTPVD03D7AUDF,VNPAYTGDD4,50000,100000,VNPAY-QR,1069000,1426000,36.0,Nam,41.0,9.6,Pin,1.0,Kính khoáng Mineral,Nhật Bản,Nên mua nha mn ơi
EDIFICE CASIO,ECB2000D1ADF,VNPAYTGDD4,50000,100000,VNPAY-QR,5286000,7048000,0.0,Nam,51.0,10.8,Ánh sáng,10.0,Kính khoáng Mineral,Nhật Bản,Sản phẩm ok
CASIO,MTPVD03L5AUDF,VNPAYTGDD4,50000,100000,VNPAY-QR,991000,1322000,36.0,Nam,41.0,9.6,Pin,1.0,Kính khoáng Mineral,Nhật Bản,Rất hài lòng về sp
CITIZEN,EU601258P,VNPAYTGDD4,50000,100000,VNPAY-QR,2496000,3840000,24.0,Nữ,26.6,6.7,Pin,5.0,Kính khoáng Mineral,Nhật Bản,Rất tốt
Q&Q,C18A004PY,VNPAYTGDD4,50000,100000,VNPAY-QR,490000,790000,24.0,Nữ,30.0,7.3,Pin,3.0,Kính khoáng Mineral,Nhật Bản,Hàng chất lượng
ELIO,EL13601,VNPAYTGDD4,50000,100000,VNPAY-QR,690000,1290000,24.0,Nữ,26.0,8.5,Pin,3.0,Kính khoáng Mineral,Việt Nam,Ok quá ok
CITIZEN,EU607051D,VNPAYTGDD4,50000,100000,VNPAY-QR,2457000,3780000,24.0,Nữ,28.0,7.8,Pin,5.0,Kính khoáng Mineral,Nhật Bản,đẹp ngon
Q&Q,C01A005PY,VNPAYTGDD4,50000,100000,VNPAY-QR,690000,1190000,24.0,Nữ,30.0,8.3,Pin,3.0,Kính khoáng Mineral,Nhật Bản,Đồng hồ đẹp chất lượng tốt nhân viên giao hàng nhiệt tình
CITIZEN,BI500010E,VNPAYTGDD4,50000,100000,VNPAY-QR,2388000,3185000,24.0,Nam,39.1,8.3,Pin,5.0,Kính khoáng Mineral,Nhật Bản,hàng tốt dây da hơi cứng tí thoy 
CITIZEN Mechanical,NH835083L,VNPAYTGDD4,50000,100000,VNPAY-QR,4638000,6185000,N/A,Nam,40.0,11.0,Cơ tự động,5.0,Kính khoáng Mineral,Nhật Bản,"Thời gian trữ cót chừng 32h, chỉnh giờ kim dây không dừng,kính cứng nên dễ trầy xước. Nói chung mức giá này thì quá ok cho em nó"
CITIZEN,FE608887A,VNPAYTGDD4,50000,100000,VNPAY-QR,3685000,5670000,0.0,Nữ,36.0,9.0,Ánh sáng,3.0,Kính khoáng Mineral,Nhật Bản,Kiểu dáng trẻ chung hiện đại
CITIZEN Mechanical,NH837388A,VNPAYTGDD4,50000,100000,VNPAY-QR,5088000,6785000,N/A,Nam,42.6,12.1,Cơ tự động,5.0,Kính khoáng Mineral,Nhật Bản,Sản phầm dùng hiện tại rất tốt. Bảo hành cũng rất ok.
CITIZEN,FE602056F,VNPAYTGDD4,50000,100000,VNPAY-QR,3139000,4830000,0.0,Nữ,35.0,9.0,Ánh sáng,5.0,Kính khoáng Mineral,Nhật Bản,N/A
CITIZEN Mechanical,NH835059B,VNPAYTGDD4,50000,100000,VNPAY-QR,4638000,6185000,N/A,Nam,40.0,11.1,Cơ tự động,5.0,Kính khoáng Mineral,Nhật Bản,"Đeo tầm 2 ngày là bị chạy nhanh giờ,cần trợ giúp"
CITIZEN,FE601688A,VNPAYTGDD4,50000,100000,VNPAY-QR,4475000,6885000,0.0,Nữ,33.0,N/A,Ánh sáng,5.0,Kính khoáng Mineral,Nhật Bản,"Sản phẩm ok,"
CITIZEN,EX149313A,VNPAYTGDD4,50000,100000,VNPAY-QR,5385000,8285000,0.0,Nữ,29.6,6.3,Ánh sáng,5.0,Kính Sapphire,Nhật Bản,Tôi rất hài lòng về sản phẩm này!
Citizen,EU609259E,VNPAYTGDD4,50000,100000,VNPAY-QR,2600000,4000000,24.0,Nữ,28.1,7.0,Pin,5.0,Kính khoáng Mineral,Nhật Bản,Đẹp
CASIO,LQ142E7ADF,VNPAYTGDD4,50000,100000,VNPAY-QR,324000,499000,36.0,Nữ,22.4,7.8,Pin,3.0,Nhựa,Nhật Bản,Tôi sẽ giới thiệu đồng hồ cho nhiều người khác nữa
ELIO,EL13402,VNPAYTGDD4,50000,100000,VNPAY-QR,690000,1090000,24.0,Nữ,28.0,8.0,Pin,3.0,Kính khoáng Mineral,Việt Nam,"Đồng hồ rất đẹp, sang trọng. Tôi thất thích"
CASIO,LRW200H7E2VDF,VNPAYTGDD4,50000,100000,VNPAY-QR,590000,939000,36.0,Nữ,34.0,11.5,Pin,10.0,Nhựa,Nhật Bản,"Đồng hồ xinh , mang rất vừa tay"
CITIZEN,AU106051A,VNPAYTGDD4,50000,100000,VNPAY-QR,4280000,6585000,0.0,Nam,39.8,8.0,Ánh sáng,3.0,Kính khoáng Mineral,Nhật Bản,Bình thường
GSHOCK,GA7001ADR,VNPAYTGDD4,50000,100000,VNPAY-QR,2779000,3706000,60.0,Nam,52.5,18.2,Pin,20.0,Kính khoáng Mineral,Nhật Bản,"Rất tốt, hàng chuẩn"
CITIZEN,BE917005L,VNPAYTGDD4,50000,100000,VNPAY-QR,2917000,3890000,24.0,Nam,39.0,10.0,Pin,5.0,Kính khoáng Mineral,Nhật Bản,Cho hỏi có bán riêng dây đeo k ạ
CASIO,LQ1421BDF,VNPAYTGDD4,50000,100000,VNPAY-QR,290000,458000,36.0,Nữ,22.4,7.8,Pin,3.0,Nhựa,Nhật Bản,Mới mua từ tháng 82023. Mà giờ hết pin
CITIZEN,AU106051E,VNPAYTGDD4,50000,100000,VNPAY-QR,4280000,6585000,0.0,Nam,40.0,8.0,Ánh sáng,3.0,Kính khoáng Mineral,Nhật Bản,Rất tốt so với tầm giá dc khuyến mại
ELIO Ngày có em,EL12804,VNPAYTGDD4,50000,100000,VNPAY-QR,690000,1190000,24.0,Nữ,32.0,9.3,Pin,3.0,Kính khoáng Mineral,Việt Nam,N/A
NAKZEN,SS8291L1NR,VNPAYTGDD4,50000,100000,VNPAY-QR,590000,1180000,12.0,Nữ,32.0,8.5,Pin,3.0,Kính khoáng Mineral,Nhật Bản,N/A
NAKZEN,SL9415LY6,VNPAYTGDD4,50000,100000,VNPAY-QR,1125000,2250000,24.0,Nữ,36.0,8.2,Pin,3.0,Kính khoáng Mineral,Nhật Bản,N/A
ELIO,EL12503,VNPAYTGDD4,50000,100000,VNPAY-QR,690000,1290000,24.0,Nữ,32.0,7.6,Pin,3.0,Kính khoáng Mineral,Việt Nam,Nhận sản phẩm không đúng theo trong hoá đơn. Đơn đồng hồ nhưng sản phẩm lại là một dây da
NAKZEN Hoa & Gió,SS9470G1,VNPAYTGDD4,50000,100000,VNPAY-QR,690000,1380000,24.0,Nam,40.0,7.5,Pin,3.0,Kính khoáng Mineral,Nhật Bản,N/A
CITIZEN Kuroshio 64,NK000117X,VNPAYTGDD4,50000,100000,VNPAY-QR,8538000,11385000,N/A,Nam,41.0,12.6,Cơ tự động,5.0,Kính khoáng Mineral,Nhật Bản,Đẹp.
NAKZEN,SL9256GBN7N3,VNPAYTGDD4,50000,100000,VNPAY-QR,890000,1780000,24.0,Nam,41.0,9.0,Pin,3.0,Kính khoáng Mineral,Nhật Bản,N/A
ELIO,ES13201,VNPAYTGDD4,50000,100000,VNPAY-QR,390000,1190000,24.0,Nữ,33.5,8.0,Pin,3.0,Kính khoáng Mineral,Việt Nam,Đồng hồ đẹp rất đáng để mua nhé mn
CITIZEN Tsuyosa,NJ015081L,VNPAYTGDD4,50000,100000,VNPAY-QR,9138000,12185000,N/A,Nam,40.0,11.7,Cơ tự động,5.0,Kính Sapphire,Nhật Bản,"Đồng  hồ chạy  nhanh  hơn  ngựa  , trung  bình  ngày  nhanh  vênh  5 đến 6 phút"
CITIZEN,BM855081E,VNPAYTGDD4,50000,100000,VNPAY-QR,4338000,5785000,60.0,Nam,41.8,10.1,Ánh sáng,10.0,Kính khoáng Mineral,Nhật Bản,Tôi cảm  thấy sản phẩm này rất tốt
CITIZEN,EW259182D,VNPAYTGDD4,50000,100000,VNPAY-QR,6230000,9585000,60.0,Nữ,29.0,8.9,Ánh sáng,5.0,Kính Sapphire,Nhật Bản,Mua eco Drive 2 năm sử dụng được 2 tháng liên tục bị chạy sai giờ. Hãng nói yếu tụ . thay tụ  lau dầu hết hơn 1tr. Rồi sau khi làm được bao lâu lại bị lại Quảng cáo 10 năm mới thay pin hoặc 5 năm bảo trì 1 lần mới ghê. Đúng là sai lầm khi mua cutizen
ELIO Flower,EL12102,VNPAYTGDD4,50000,100000,VNPAY-QR,690000,1290000,24.0,Nữ,33.0,8.0,Pin,3.0,Kính khoáng Mineral,Việt Nam,Rất tốt
ELIO Flower,EL12103,VNPAYTGDD4,50000,100000,VNPAY-QR,690000,1290000,24.0,Nữ,33.0,8.0,Pin,3.0,Kính khoáng Mineral,Việt Nam,Đồng hồ đẹp. Thích nhất là mặt phản chiếu lắp lánh
CITIZEN Tsuyosa,NJ015081A,VNPAYTGDD4,50000,100000,VNPAY-QR,9138000,12185000,N/A,Nam,40.0,11.7,Cơ tự động,5.0,Kính Sapphire,Nhật Bản,Mặt kính Sapphire dây thép ko gỉ Máy cơ tự động. Nam tính tuyệt vời. Ngon nhất là mua đc với giá sale tốt.
ELIO Flower,ES12801,VNPAYTGDD4,50000,100000,VNPAY-QR,690000,1290000,24.0,Nữ,35.0,9.3,Pin,3.0,Kính khoáng Mineral,Việt Nam,Dây thiết kế hơi khó đeo nhưng xinh nha
ELIO,EL11702,VNPAYTGDD4,50000,100000,VNPAY-QR,690000,1290000,24.0,Nữ,30.0,7.5,Pin,3.0,Kính khoáng Mineral,Việt Nam,Quá là toẹt vời
NAKZEN,SS4036GD7N3,VNPAYTGDD4,50000,100000,VNPAY-QR,990000,1980000,24.0,Nam,38.0,7.0,Pin,3.0,Kính Sapphire,Nhật Bản,"Tư vấn nhiệt tình, chất lượng cao"
NAKZEN,SS4117LD7N3,VNPAYTGDD4,50000,100000,VNPAY-QR,990000,1980000,24.0,Nữ,25.0,7.4,Pin,3.0,Kính khoáng Mineral,Nhật Bản,"Đồng hồ đẹp, phù hợp với lứa tuổi"
NAKZEN,SL8334LBK1NR,VNPAYTGDD4,50000,100000,VNPAY-QR,550000,1100000,12.0,Nữ,32.0,9.3,Pin,3.0,Kính khoáng Mineral,Nhật Bản,Khá ok nhưng Sài thời gian coi sao
Q&Q,VQ86J047Y,VNPAYTGDD4,50000,100000,VNPAY-QR,290000,459000,36.0,Nữ,34.0,10.0,Pin,10.0,Kính Acrylic (thủy tinh hữu cơ),Nhật Bản,Gửi cho cái đồng hồ hết pin mất uy tín
NAKZEN,SL4050GD7,VNPAYTGDD4,50000,100000,VNPAY-QR,715000,1430000,24.0,Nam,40.0,7.0,Pin,3.0,Kính Sapphire,Nhật Bản,Sản phẩm rất tốt
MVW,ML06902,VNPAYTGDD4,50000,100000,VNPAY-QR,590000,1290000,36.0,Nam,42.0,11.0,Pin,5.0,Kính khoáng Mineral,Việt Nam,Sử dụng đến nay chưa thấy gì trục trặc
MVW,ML06702,VNPAYTGDD4,50000,100000,VNPAY-QR,490000,1290000,36.0,Nam,40.0,8.0,Pin,5.0,Kính khoáng Mineral,Việt Nam,"Rất ổn, mua được đợt sale giảm còn 430K."
Q&Q,G19A001VY,VNPAYTGDD4,50000,100000,VNPAY-QR,490000,790000,24.0,Nam,50.0,13.8,Pin,10.0,Kính Acrylic (thủy tinh hữu cơ),Nhật Bản,N/A
CITIZEN,BI510457E,VNPAYTGDD4,50000,100000,VNPAY-QR,3963000,5285000,24.0,Nam,41.0,9.0,Pin,5.0,Kính khoáng Mineral,Nhật Bản,N/A
ELIO Nắng Xuân,EL06302,VNPAYTGDD4,50000,100000,VNPAY-QR,290000,990000,36.0,Nữ,32.0,8.0,Pin,3.0,Kính khoáng Mineral,Việt Nam,"Đồng hồ rất đẹp ! 
Bạn Tú tư vấn rất tuyệt vời"
MVW Hồn Việt,MLA08603HV,VNPAYTGDD4,50000,100000,VNPAY-QR,1990000,3490000,N/A,Nam,43.0,12.4,Cơ tự động,5.0,Kính Sapphire,Việt Nam,Đồng hồ đẹp kiểu dáng trẻ trung nhưng chạy lệch khoảng 2530s 1 ngày mua 5 đem ra bảo hành thử kq là vẫn vậy trong mặt đồng hồ thì có bụi mặt sau thì bị trầy khá nhiều do lấy sản phẩm buổi tối nên ko để ý kĩ về xem lại mới thấy
EDIFICE CASIO,ECB2200DC1ADF,VNPAYTGDD4,50000,100000,VNPAY-QR,5210000,8811000,18.0,Nam,48.2,11.9,Ánh sáng,10.0,Kính khoáng Mineral,Nhật Bản,N/A
ORIENT Sun & Moon,RAAK0011D10B,VNPAYTGDD4,50000,100000,VNPAY-QR,7990000,13080000,N/A,Nam,42.5,14.0,Cơ tự động,5.0,Kính Sapphire,Nhật Bản,N/A
MVW,MS07901,VNPAYTGDD4,50000,100000,VNPAY-QR,790000,1490000,36.0,Nam,41.0,10.0,Pin,5.0,Kính khoáng Mineral,Việt Nam,Ngày nhảy chậm vs thứ củng nhảy nữa rồi ngưng đó xíu nhảy tiếp
MVW,MS07801,VNPAYTGDD4,50000,100000,VNPAY-QR,990000,1990000,36.0,Nam,39.6,9.0,Pin,5.0,Kính khoáng Mineral,Việt Nam,Đồng hồ bị mờ màn hình có dán mặt kiếng đc k ạ
ELIO Flower,ES11902,VNPAYTGDD4,50000,100000,VNPAY-QR,690000,1290000,24.0,Nữ,30.0,8.0,Pin,3.0,Kính khoáng Mineral,Việt Nam,SP OK nhưng khâu bán hàng tệ. Đánh giá 1 và chê. Thất vọng với cách làm việc của TGDD.
ELIO Flower,EL10503,VNPAYTGDD4,50000,100000,VNPAY-QR,390000,990000,24.0,Nữ,35.0,9.0,Pin,3.0,Kính khoáng Mineral,Việt Nam,Đẹp lắm ạ
ELIO,ES11602,VNPAYTGDD4,50000,100000,VNPAY-QR,690000,1090000,24.0,Nữ,31.0,8.0,Pin,3.0,Kính khoáng Mineral,Việt Nam,Đồng hồ rất đẹp lun
Q&Q,C20A002VY,VNPAYTGDD4,50000,100000,VNPAY-QR,690000,1190000,24.0,Nam,44.0,10.3,Pin,5.0,Kính khoáng Mineral,Nhật Bản,N/A
Q&Q,Q06A001PY,VNPAYTGDD4,50000,100000,VNPAY-QR,490000,690000,24.0,Nữ,22.0,9.2,Pin,3.0,Kính khoáng Mineral,Nhật Bản,N/A
Q&Q,CE02J422Y,VNPAYTGDD4,50000,100000,VNPAY-QR,890000,1490000,24.0,Nam,44.0,9.9,Pin,5.0,Kính khoáng Mineral,Nhật Bản,N/A
Q&Q,C53A004VY,VNPAYTGDD4,50000,100000,VNPAY-QR,690000,1190000,24.0,Nữ,29.0,7.6,Pin,5.0,Kính khoáng Mineral,Nhật Bản,N/A
ELIO,EL09501,VNPAYTGDD4,50000,100000,VNPAY-QR,690000,1290000,24.0,Nữ,30.0,7.8,Pin,3.0,Kính khoáng Mineral,Việt Nam,"Đồng xinh lắm ạ. Mình săn sale giá 212k, lấy hàng tại store nhưng các bạn rất nhiệt tình hỗ trợ mình.rcm Bác bv cn hậu giang siêu dễ thương nữa"
ELIO Flower,ES11001,VNPAYTGDD4,50000,100000,VNPAY-QR,290000,990000,24.0,Nữ,28.0,8.0,Pin,3.0,Kính khoáng Mineral,Việt Nam,Tốt
ELIO,ES11803,VNPAYTGDD4,50000,100000,VNPAY-QR,690000,990000,24.0,Nữ,34.0,8.0,Pin,3.0,Kính khoáng Mineral,Việt Nam,đh đep sang
MVW Elegant,MS09602ELE,VNPAYTGDD4,50000,100000,VNPAY-QR,1290000,2490000,36.0,Nam,40.0,9.5,Pin,5.0,Kính Sapphire,Việt Nam,N/A
ELIO,ES14101,VNPAYTGDD4,50000,100000,VNPAY-QR,690000,1290000,24.0,Nữ,30.0,7.8,Pin,3.0,Kính khoáng Mineral,Việt Nam,N/A
ELIO,EC02102,VNPAYTGDD4,50000,100000,VNPAY-QR,690000,1290000,24.0,Nữ,29.0,8.7,Pin,3.0,Kính khoáng Mineral,Việt Nam,Tốt trong tầm giá
